<?xml version="1.0" encoding="UTF-8" standalone="no"?>


<listaPedidos
xmlns:xs="http://www.w3.org/2001/XMLSchema-instance"
xs:noNamespaceSchemaLocation="ActividadLM4.7.1.xsd">

    <pedido numPedido="023">
        <nombreCliente> Rodrigo Goes </nombreCliente>
        <mesaEntrega> 8 </mesaEntrega>
        <fecha> 
            <dia> 10 </dia>
            <mes> Febrero </mes>
            <anho> 2024 </anho>
            <hora> 14:00 </hora>
        </fecha>
        <listaProductos>
            <producto>
                <hamburguesa>
                    <nombre codProducto="H303"> Burguer Cangreburguer </nombre>
                    <numero> 1 </numero>
                    <precio> 5.50 </precio>
                </hamburguesa>
            </producto>
            <producto>
                <complemento>
                    <nombre codProducto="P03"> Patatas deluxe </nombre>
                    <numero> 1 </numero>
                    <precio> 1.20 </precio>
                </complemento>
            </producto> 
        </listaProductos>
        <precioTotal> 6.70 </precioTotal>
    </pedido>
    <pedido numPedido="024">
        <nombreCliente> Eustaquio </nombreCliente>
        <fecha>
            <dia> 10 </dia>
            <mes> Febrero </mes>
            <anho> 2024 </anho>
            <hora> 14:15 </hora>
        </fecha>
        <listaProductos>
            <producto>
                <complemento>
                    <nombre codProducto="Hl10"> Helado con caramelo </nombre>
                    <numero> 1 </numero>
                    <precio> 1.70 </precio>
                </complemento>
            </producto>
        </listaProductos>
        <precioTotal> 1.70 </precioTotal>
    </pedido>
</listaPedidos>
